,Field,Cites,Authors,Title,Year,Source,Publisher,ArticleURL,CitesURL,GSRank,QueryDate,Type,DOI,ISSN,CitationURL,Volume,Issue,StartPage,EndPage,ECC,CitesPerYear,CitesPerAuthor,AuthorCount,Age
34,ag,11,"M Abdullah, M Akram, WA Khan, ...",Selecting halophytic shrubs for the Cholistan desert,1993,ACIAR …,ageconsearch.umn.edu,https://ageconsearch.umn.edu/record/134659/files/PR042.pdf#page=43,"https://scholar.google.com/scholar?cites=7091005727540848098&as_sdt=2005&sciodt=0,5&hl=en",271,2019-09-07 23:36:05,PDF,,,,,,,,11,0.42,3,4,26
549,rest,1,LC Hundy,Plant Growth and Soil Shear Strength in Relation to Soil Properties and Hydro-Edaphic Characteristics of Restored Louisiana Salt Marshes,2015,,search.proquest.com,http://search.proquest.com/openview/7fe1e3c3246e03cf3e5074e0a0cb7fec/1?pq-origsite=gscholar&cbl=18750&diss=y,"https://scholar.google.com/scholar?cites=7447512157682149988&as_sdt=2005&sciodt=0,5&hl=en",271,2019-09-07 23:54:23,BOOK,,,,,,,,1,0.25,1,1,4
350,rest,14,"HN Badi, A Sorooshzadeh",Evaluating potential of borage (Borago officinalis L.) in bioremediation of saline soil,2011,African Journal of Biotechnology,ajol.info,https://www.ajol.info/index.php/ajb/article/view/137935,"https://scholar.google.com/scholar?cites=1037476413689406787&as_sdt=2005&sciodt=0,5&hl=en",272,2019-09-07 23:54:23,,,,,,,,,14,1.75,7,2,8
684,ag,21,"S Navarro‐Torre, JM Barcia‐Piedras, ...",Assessing the role of endophytic bacteria in the halophyte Arthrocnemum macrostachyum salt tolerance,2017,Plant …,Wiley Online Library,https://onlinelibrary.wiley.com/doi/abs/10.1111/plb.12521,"https://scholar.google.com/scholar?cites=5291115811226574950&as_sdt=2005&sciodt=0,5&hl=en",272,2019-09-07 23:36:05,,,,,,,,,21,10.5,7,3,2
624,ag,7,"MK Patel, A Mishra, B Jha",Untargeted metabolomics of halophytes,2016,Marine OMICS,content.taylorfrancis.com,https://content.taylorfrancis.com/books/e/download?dac=C2014-0-30925-5&isbn=9781482258219&doi=10.1201/9781315372303-31&format=pdf,"https://scholar.google.com/scholar?cites=2187803515515096402&as_sdt=2005&sciodt=0,5&hl=en",273,2019-09-07 23:36:05,,,,,,,,,7,2.33,2,3,3
669,rest,0,"R Thangavel, R Karunanithi…",12 Phytotechnologies for Mine Site Rehabilitation,2017,Spoil to Soil: Mine …,books.google.com,https://books.google.com/books?hl=en&lr=&id=JEKgDwAAQBAJ&oi=fnd&pg=PA203&dq=halophyte+restoration+remediation&ots=389JfUe9GO&sig=wmz7Bh3AawE4_sMdVCsnYnGpkLs,,273,2019-09-07 23:54:23,,,,,,,,,0,0,0,3,2
207,rest,1,"Y WANG, R YANG, D GONG…",Remediation of the Arsenic Contaminated Soil by Artificial Ecosystem [J],2007,Hunan Agricultural …,en.cnki.com.cn,http://en.cnki.com.cn/Article_en/CJFDTotal-HNNK200703035.htm,"https://scholar.google.com/scholar?cites=6769276251459466650&as_sdt=2005&sciodt=0,5&hl=en",274,2019-09-07 23:54:23,,,,,,,,,1,0.08,0,4,12
462,ag,112,"B Gul, R Ansari, TJ Flowers, MA Khan",Germination strategies of halophyte seeds under salinity,2013,Environmental and Experimental …,Elsevier,https://www.sciencedirect.com/science/article/pii/S0098847212002316,"https://scholar.google.com/scholar?cites=11265235952675902703&as_sdt=2005&sciodt=0,5&hl=en",274,2019-09-07 23:36:05,,,,,,,,,112,18.67,28,4,6
625,ag,14,"A Kumar, A Kumar, C Lata, S Kumar",Eco-physiological responses of Aeluropus lagopoides (grass halophyte) and Suaeda nudiflora (non-grass halophyte) under individual and interactive sodic …,2016,South African journal of botany,Elsevier,https://www.sciencedirect.com/science/article/pii/S0254629916002441,"https://scholar.google.com/scholar?cites=13139710791224340001&as_sdt=2005&sciodt=0,5&hl=en",275,2019-09-07 23:36:05,HTML,,,,,,,,14,4.67,4,4,3
709,rest,0,"C Li, R Liu, S Wang, Y Sun, S Li, H Zhang, J Gao…","Growth and sustainability of Suaeda salsa in the Lop Nur, China",2018,Journal of Arid Land,Springer,https://link.springer.com/article/10.1007/s40333-018-0002-5,,275,2019-09-07 23:54:23,,,,,,,,,0,0,0,8,1
69,ag,127,"Z Miszalski, I Ślesak, E Niewiadomska, ...",… localization and stress responses of superoxide dismutase isoforms from leaves in the C3‐CAM intermediate halophyte Mesembryanthemum crystallinum L.,1998,"Plant, Cell & …",Wiley Online Library,https://onlinelibrary.wiley.com/doi/abs/10.1046/j.1365-3040.1998.00266.x,"https://scholar.google.com/scholar?cites=4872787624507910178&as_sdt=2005&sciodt=0,5&hl=en",276,2019-09-07 23:36:05,,,,,,,,,127,6.05,32,4,21
159,rest,0,"KY Biel, NY Yensen","Region, Russia;* NyPa International, Tucson, Arizona, USA",2005,… : Functional Foods Can Help Reduce the …,books.google.com,https://books.google.com/books?hl=en&lr=&id=zhJ74_wDU2IC&oi=fnd&pg=PA215&dq=halophyte+restoration+remediation&ots=dFv9aoq04B&sig=Uj9AbOi5EW2x4tv1cD_pF0av3jM,,276,2019-09-07 23:54:23,,,,,,,,,0,0,0,2,14
262,ag,20,"KN Toderich, S Ismail, EA Juylova, ...","New approaches for biosaline agriculture development, management and conservation of sandy desert ecosystems",2008,Biosaline Agriculture …,Springer,https://link.springer.com/chapter/10.1007/978-3-7643-8554-5_23,"https://scholar.google.com/scholar?cites=10868374595316732593&as_sdt=2005&sciodt=0,5&hl=en",277,2019-09-07 23:36:05,,,,,,,,,20,1.82,5,4,11
601,rest,2,"P Kamiński, T Barczak, J Bennewicz, L Jerzak…",Effects of chemical elements in the trophic levels of natural salt marshes,2016,… geochemistry and health,Springer,https://link.springer.com/article/10.1007/s10653-015-9761-5,"https://scholar.google.com/scholar?cites=7084675697372036535&as_sdt=2005&sciodt=0,5&hl=en",277,2019-09-07 23:54:23,,,,,,,,,2,0.67,0,5,3
626,ag,13,"C Ozfidan-Konakci, B Uzilday, R Ozgur, ...","Halophytes as a source of salt tolerance genes and mechanisms: a case study for the Salt Lake area, Turkey",2016,Functional Plant …,CSIRO,http://www.publish.csiro.au/FP/FP15288,"https://scholar.google.com/scholar?cites=6299317024797796589&as_sdt=2005&sciodt=0,5&hl=en",278,2019-09-07 23:36:05,,,,,,,,,13,4.33,3,4,3
670,rest,3,"YH You, JM Park, YG Seo, W Lee, MS Kang, JG Kim","Distribution, characterization, and diversity of the endophytic fungal communities on Korean seacoasts showing contrasting geographic conditions",2017,Mycobiology,Taylor & Francis,https://www.tandfonline.com/doi/abs/10.5941/MYCO.2017.45.3.150,"https://scholar.google.com/scholar?cites=12126820635918975474&as_sdt=2005&sciodt=0,5&hl=en",278,2019-09-07 23:54:23,,,,,,,,,3,1.5,1,6,2
45,rest,39,"L Wu, J Chen, KK Tanji…",Distribution and biomagnification of selenium in a restored upland grassland contaminated by selenium from agricultural drain water,1995,… Toxicology and Chemistry …,Wiley Online Library,https://setac.onlinelibrary.wiley.com/doi/abs/10.1002/etc.5620140422,"https://scholar.google.com/scholar?cites=11466292133918595326&as_sdt=2005&sciodt=0,5&hl=en",279,2019-09-07 23:54:23,,,,,,,,,39,1.63,10,4,24
572,ag,38,"H Zhang, G Zhang, X Lü, D Zhou, X Han",Salt tolerance during seed germination and early seedling stages of 12 halophytes,2015,Plant and Soil,Springer,https://link.springer.com/article/10.1007/s11104-014-2322-3,"https://scholar.google.com/scholar?cites=17005257102000614739&as_sdt=2005&sciodt=0,5&hl=en",279,2019-09-07 23:36:05,,,,,,,,,38,9.5,8,5,4
218,ag,7,MY Ashraf,Variation in nutritional composition and growth performance of some halophytic species grown under saline conditions,2007,African Journal of Range and Forage Science,Taylor & Francis,https://www.tandfonline.com/doi/abs/10.2989/102201107780178203,"https://scholar.google.com/scholar?cites=172268492911819700&as_sdt=2005&sciodt=0,5&hl=en",280,2019-09-07 23:36:05,,,,,,,,,7,0.58,7,1,12
351,rest,2,"HL Koh, DL DeAngelis, SY Teh",Mangrove wetland ecosystem modeling in the Everglades,2011,"… : Ecology, Biology and …",miami.pure.elsevier.com,https://miami.pure.elsevier.com/en/publications/mangrove-wetland-ecosystem-modeling-in-the-everglades,"https://scholar.google.com/scholar?cites=9389150908440696346&as_sdt=2005&sciodt=0,5&hl=en",280,2019-09-07 23:54:23,,,,,,,,,2,0.25,1,3,8
43,ag,34,"E Troyo-Diéguez, A Ortega-Rubio, Y Maya, ...","The effect of environmental conditions on the growth and development of the oilseed halophyte Salicornia bigelovii Torr. in arid Baja California Sur, Mexico",1994,Journal of Arid …,Elsevier,https://www.sciencedirect.com/science/article/pii/S0140196305800588,"https://scholar.google.com/scholar?cites=943487730712578421&as_sdt=2005&sciodt=0,5&hl=en",281,2019-09-07 23:36:05,,,,,,,,,34,1.36,9,4,25
758,rest,0,"C Yajun, Z Ya, L Naiwei, L Xiaojing…",Biomass production and nutrient removal efficiency of Suaeda salsa in eutrophic saline water using a floating mat treatment system,2019,Water Science and …,iwaponline.com,https://iwaponline.com/ws/article-abstract/19/1/254/39205,,281,2019-09-07 23:54:23,,,,,,,,,0,0,0,5,1
198,ag,11,"GCQHL Xiaoping, LQDHC Xi",Application of gypsums from flue gas desulfurization in agriculture [J],2006,Techniques and Equipment for …,en.cnki.com.cn,http://en.cnki.com.cn/Article_en/CJFDTotal-HJJZ200612003.htm,"https://scholar.google.com/scholar?cites=10525702320818054844&as_sdt=2005&sciodt=0,5&hl=en",282,2019-09-07 23:36:05,,,,,,,,,11,0.85,6,2,13
308,rest,58,T Mahmood,Phytoextraction of heavy metals-the process and scope for remediation of contaminated soils,2010,Soil Environ,researchgate.net,https://www.researchgate.net/profile/Tariq_Mahmood37/publication/262313714_Phytoextraction_of_heavy_metals_-_the_process_and_scope_for_remediation_of_contaminated_soils_Review_article/links/0deec5376013320dc8000000/Phytoextraction-of-heavy-metals-the-process-and-scope-for-remediation-of-contaminated-soils-Review-article.pdf,"https://scholar.google.com/scholar?cites=13262190510326276668&as_sdt=2005&sciodt=0,5&hl=en",282,2019-09-07 23:54:23,PDF,,,,,,,,58,6.44,58,1,9
160,rest,94,"F Caravaca, MM Alguacil, P Torres, A Roldán",Plant type mediates rhizospheric microbial activities and soil aggregation in a semiarid Mediterranean salt marsh,2005,Geoderma,Elsevier,https://www.sciencedirect.com/science/article/pii/S0016706104001405,"https://scholar.google.com/scholar?cites=8874899974133560014&as_sdt=2005&sciodt=0,5&hl=en",283,2019-09-07 23:54:23,,,,,,,,,94,6.71,24,4,14
409,ag,89,"N Baisakh, MV RamanaRao, ...",Enhanced salt stress tolerance of rice plants expressing a vacuolar H+‐ATPase subunit c1 (SaVHAc1) gene from the halophyte grass Spartina alterniflora Löisel,2012,Plant biotechnology …,Wiley Online Library,https://onlinelibrary.wiley.com/doi/abs/10.1111/j.1467-7652.2012.00678.x,"https://scholar.google.com/scholar?cites=11840443856899892546&as_sdt=2005&sciodt=0,5&hl=en",283,2019-09-07 23:36:05,,,,,,,,,89,12.71,30,3,7
199,ag,15,"A Hameed, MZ Ahmed, MA Khan",Comparative effects of NaCl and seasalt on seed germination of coastal halophytes,2006,Pak. J. Bot,academia.edu,http://www.academia.edu/download/45451276/133.pdf,"https://scholar.google.com/scholar?cites=2103539168867969682&as_sdt=2005&sciodt=0,5&hl=en",284,2019-09-07 23:36:05,PDF,,,,,,,,15,1.15,5,3,13
505,rest,0,"YJ Lee, JH Choi, SJ Sim, TH Ha…",A Field Study on Electrokinetic Removal of Salts from Greenhouse Soil,2014,Korean Chemical …,koreascience.or.kr,http://www.koreascience.or.kr/article/JAKO201405262620596.page,,284,2019-09-07 23:54:23,,,,,,,,,0,0,0,5,5
135,ag,4,"B Gul, MA Khan",Saline Agriculture: promises and prospects for future agriculture in degraded saline lands,2003,,Citeseer,http://citeseerx.ist.psu.edu/viewdoc/summary?doi=10.1.1.719.2552,"https://scholar.google.com/scholar?cites=3255256949648897029&as_sdt=2005&sciodt=0,5&hl=en",285,2019-09-07 23:36:05,,,,,,,,,4,0.25,2,2,16
671,rest,1,"AR Ferreira, A Ribeiro, N Couto",Remediation of pharmaceutical and personal care products (PPCPs) in constructed wetlands: applicability and new perspectives,2017,Phytoremediation,Springer,https://link.springer.com/chapter/10.1007/978-3-319-52381-1_9,"https://scholar.google.com/scholar?cites=8609341713082045537&as_sdt=2005&sciodt=0,5&hl=en",285,2019-09-07 23:54:23,,,,,,,,,1,0.5,0,3,2
219,ag,260,"C Yang, J Chong, C Li, C Kim, D Shi, D Wang",Osmotic adjustment and ion balance traits of an alkali resistant halophyte Kochia sieversiana during adaptation to salt and alkali conditions,2007,Plant and Soil,Springer,https://link.springer.com/article/10.1007/s11104-007-9251-3,"https://scholar.google.com/scholar?cites=14784988902309033665&as_sdt=2005&sciodt=0,5&hl=en",286,2019-09-07 23:36:05,,,,,,,,,260,21.67,43,6,12
309,rest,1,AIF Sousa,Nitrogen and metals as multiple stressors affecting the auto-remediation role of salt marshes: consequences to the ecosystem services,2010,,repositorio.ul.pt,http://repositorio.ul.pt/handle/10451/2342,"https://scholar.google.com/scholar?cites=15336739695631239659&as_sdt=2005&sciodt=0,5&hl=en",286,2019-09-07 23:54:23,,,,,,,,,1,0.11,1,1,9
88,ag,4,ZKFFAN Hai,Halophyte Resources in the World that Allow Seawater Irrigation [J],2000,CHINESE BULLETIN OF BOTANY,en.cnki.com.cn,http://en.cnki.com.cn/Article_en/CJFDTotal-ZWXT200003017.htm,"https://scholar.google.com/scholar?cites=355251027015293635&as_sdt=2005&sciodt=0,5&hl=en",287,2019-09-07 23:36:05,,,,,,,,,4,0.21,4,1,19
550,rest,33,"K Kennen, N Kirkwood",Phyto: principles and resources for site remediation and landscape design,2015,,taylorfrancis.com,https://www.taylorfrancis.com/books/9781315746661,"https://scholar.google.com/scholar?cites=5503070007911236066&as_sdt=2005&sciodt=0,5&hl=en",287,2019-09-07 23:54:23,BOOK,,,,,,,,33,8.25,17,2,4
602,rest,9,"KI Paredes-Páliz, E Pajuelo, B Doukkali…",Bacterial inoculants for enhanced seed germination of Spartina densiflora: Implications for restoration of metal polluted areas,2016,Marine pollution …,Elsevier,https://www.sciencedirect.com/science/article/pii/S0025326X16304404,"https://scholar.google.com/scholar?cites=18376880240772652732&as_sdt=2005&sciodt=0,5&hl=en",288,2019-09-07 23:54:23,,,,,,,,,9,3,2,4,3
685,ag,7,"G Atzori, AC de Vos, M van Rijsselberghe, ...",Effects of increased seawater salinity irrigation on growth and quality of the edible halophyte Mesembryanthemum crystallinum L. under field conditions,2017,Agricultural water …,Elsevier,https://www.sciencedirect.com/science/article/pii/S0378377417300999,"https://scholar.google.com/scholar?cites=18007400257508804852&as_sdt=2005&sciodt=0,5&hl=en",288,2019-09-07 23:36:05,,,,,,,,,7,3.5,2,4,2
70,ag,173,"JL Tella, MG Forero, F Hiraldo, ...",Conflicts between Lesser Kestrel Conservation and European Agricultural Policies as Identif ied by Habitat Use Analyses,1998,Conservation …,Wiley Online Library,https://onlinelibrary.wiley.com/doi/abs/10.1111/j.1523-1739.1998.96288.x,"https://scholar.google.com/scholar?cites=6472254449821707235&as_sdt=2005&sciodt=0,5&hl=en",289,2019-09-07 23:36:05,,,,,,,,,173,8.24,43,4,21
603,rest,54,"P Gkorezis, M Daghio, A Franzetti…",The interaction between plants and bacteria in the remediation of petroleum hydrocarbons: an environmental perspective,2016,Frontiers in …,frontiersin.org,https://www.frontiersin.org/articles/10.3389/fmicb.2016.01836,"https://scholar.google.com/scholar?cites=9640573802712905097&as_sdt=2005&sciodt=0,5&hl=en",289,2019-09-07 23:54:23,HTML,,,,,,,,54,18,14,4,3
58,ag,14,S Miyamoto,"Salt tolerance, water use and potential irrigation scheduling of halophytes",1996,Halophytes and biosaline agriculture,books.google.com,https://books.google.com/books?hl=en&lr=&id=k_mW2p_KnaYC&oi=fnd&pg=PA181&dq=halophyte+agriculture&ots=q3GGd0A5Jf&sig=BGwJAM0VI3MiQQYA5y-Z5sps_uw,"https://scholar.google.com/scholar?cites=16952120498478956101&as_sdt=2005&sciodt=0,5&hl=en",290,2019-09-07 23:36:05,,,,,,,,,14,0.61,14,1,23
72,rest,43,JB Zedler,The ecological restoration spectrum,1999,An international perspective on wetland rehabilitation,Springer,https://link.springer.com/chapter/10.1007/978-94-011-4683-8_29,"https://scholar.google.com/scholar?cites=17771124414312604619&as_sdt=2005&sciodt=0,5&hl=en",290,2019-09-07 23:54:23,,,,,,,,,43,2.15,43,1,20
99,ag,8,"AA Al-Jaloud, MY Al-Saiady, AM Assaeed, ...","Some halophyte plants of Saudi Arabia, their composition and relation to soil properties",2001,Pakistan Journal of …,scialert.net,https://scialert.net/abstractmobile/?doi=pjbs.2001.531.534,"https://scholar.google.com/scholar?cites=7338997886910782969&as_sdt=2005&sciodt=0,5&hl=en",291,2019-09-07 23:36:05,,,,,,,,,8,0.44,2,4,18
788,rest,0,"N Ahalya, TV Ramachandra",Wetlands of Karnataka,,wgbis.ces.iisc.ernet.in,,http://wgbis.ces.iisc.ernet.in/energy/lake2006/programme/programme/lc.htm,,291,2019-09-07 23:54:23,HTML,,,,,,,,0,0,0,2,
352,rest,0,"Y Yu, Y Chen, C Guo, Z Lu",Effects of organic amendments on the salt-affected soil,2011,2011 International Conference …,ieeexplore.ieee.org,https://ieeexplore.ieee.org/abstract/document/5964977/,,292,2019-09-07 23:54:23,,,,,,,,,0,0,0,4,8
525,ag,17,"MA Zakery-Asl, S Bolandnazar, ...","Effect of salinity and nitrogen on growth, sodium, potassium accumulation, and osmotic adjustment of halophyte Suaeda aegyptiaca (Hasselq.) Zoh",2014,Archives of Agronomy and …,Taylor & Francis,https://www.tandfonline.com/doi/abs/10.1080/03650340.2013.841889,"https://scholar.google.com/scholar?cites=9558761996672289392&as_sdt=2005&sciodt=0,5&hl=en",292,2019-09-07 23:36:05,,,,,,,,,17,3.4,6,3,5
152,ag,178,"O Vicente, M Boscaiu, MÁ Naranjo, E Estrelles, ...",Responses to salt stress in the halophyte Plantago crassifolia (Plantaginaceae),2004,Journal of Arid …,Elsevier,https://www.sciencedirect.com/science/article/pii/S0140196303001800,"https://scholar.google.com/scholar?cites=3682198906072133636&as_sdt=2005&sciodt=0,5&hl=en",293,2019-09-07 23:36:05,,,,,,,,,178,11.87,36,5,15
433,rest,8,"R Cozza, L Bruno, MB Bitonti",Expression pattern of a type-2 metallothionein gene in a wild population of the psammophyte Silene nicaeensis,2013,Protoplasma,Springer,https://link.springer.com/article/10.1007/s00709-012-0425-3,"https://scholar.google.com/scholar?cites=13820102910790592531&as_sdt=2005&sciodt=0,5&hl=en",293,2019-09-07 23:54:23,,,,,,,,,8,1.33,3,3,6
410,ag,33,"CJ Ruan, WH Xing, JAT da Silva",Potential of five plants growing on unproductive agricultural lands as biodiesel resources,2012,Renewable Energy,Elsevier,https://www.sciencedirect.com/science/article/pii/S0960148111005982,"https://scholar.google.com/scholar?cites=10914793944477015642&as_sdt=2005&sciodt=0,5&hl=en",294,2019-09-07 23:36:05,,,,,,,,,33,4.71,11,3,7
710,rest,0,"M Perdikaki, A Kallioras, K Monokrousou…",Integrated Subsurface Water Solutions for Coastal Wetland Restoration through Integrated Pump&Treat and Aquifer Storage and Recovery (ASR),2018,Multidisciplinary Digital …,mdpi.com,https://www.mdpi.com/2504-3900/2/11/665,,294,2019-09-07 23:54:23,,,,,,,,,0,0,0,4,1
63,ag,4,"X Wen, Z Zhenxia, J Huixian",STUDIES ON ECOLOGY OF A TYPICAL HALOPHYTE── AELUROPUS LITTORALIS (GOUAN) PARL [J],1997,ACTA BOTANICA BOREALI …,en.cnki.com.cn,http://en.cnki.com.cn/Article_en/CJFDTotal-DNYX199706000.htm,"https://scholar.google.com/scholar?cites=4823536021653866280&as_sdt=2005&sciodt=0,5&hl=en",295,2019-09-07 23:36:05,,,,,,,,,4,0.18,1,3,22
759,rest,0,"V Shankar, H Evelin",Strategies for Reclamation of Saline Soils,2019,… in Saline Environments: Strategies and Functions,Springer,https://link.springer.com/chapter/10.1007/978-3-030-18975-4_19,,295,2019-09-07 23:54:23,,,,,,,,,0,0,0,2,1
686,ag,11,"C Boestfleisch, J Papenbrock","Changes in secondary metabolites in the halophytic putative crop species Crithmum maritimum L., Triglochin maritima L. and Halimione portulacoides (L.) …",2017,PloS one,journals.plos.org,https://journals.plos.org/plosone/article?id=10.1371/journal.pone.0176303,"https://scholar.google.com/scholar?cites=3344604797072171589&as_sdt=2005&sciodt=0,5&hl=en",296,2019-09-07 23:36:05,HTML,,,,,,,,11,5.5,6,2,2
789,rest,0,"L Zaikowski, P Lichtman",ScienceintoActionL,,people.uncw.edu,,http://people.uncw.edu/kubaskod/Island_Ecology/Readings/Env_Research_Sci_Act.pdf,,296,2019-09-07 23:54:23,PDF,,,,,,,,0,0,0,2,
263,ag,6,SA ATTIA-ISMAIL,27 Role of Minerals in Halophyte Feeding to Ruminants,2008,,researchgate.net,https://www.researchgate.net/profile/Prof_Salah_Attia-Ismail/publication/272094838_Role_of_Minerals_in_Halophyte_Feeding_to_Ruminants/links/54db28f00cf233119bc552f1/Role-of-Minerals-in-Halophyte-Feeding-to-Ruminants.pdf,"https://scholar.google.com/scholar?cites=7235477793031199957&as_sdt=2005&sciodt=0,5&hl=en",297,2019-09-07 23:36:05,PDF,,,,,,,,6,0.55,6,1,11
353,rest,0,"MA Fullen, A Kelay, CD Williams",Remediation of oil spills using zeolites,2011,,wlv.openrepository.com,https://wlv.openrepository.com/handle/2436/131890,,297,2019-09-07 23:54:23,,,,,,,,,0,0,0,3,8
168,ag,4,"V Sardo, A Hamdy",HALOPHYTES œ A PRECIOUS RESOURCE,2005,Options Méditerranéennes: Série B …,ressources.ciheam.org,http://ressources.ciheam.org/om/pdf/b53/00800756.pdf,"https://scholar.google.com/scholar?cites=11779633168668046138&as_sdt=2005&sciodt=0,5&hl=en",298,2019-09-07 23:36:05,PDF,,,,,,,,4,0.29,2,2,14
766,rest,0,N Srivastava,Reclamation of Saline and Sodic Soil Through Phytoremediation,2020,Environmental Concerns and Sustainable …,Springer,https://link.springer.com/chapter/10.1007/978-981-13-6358-0_11,,298,2019-09-07 23:54:23,,,,,,,,,0,0,0,1,1
233,rest,35,"CMJ Williams, TK Biswas, ID Black, L Marton…",Use of poor quality water to produce high biomass yields of giant reed (Arundo donax L.) on marginal lands for biofuel or pulp/paper,2008,… on Underutilized Plants …,actahort.org,https://www.actahort.org/books/806/806_74.htm,"https://scholar.google.com/scholar?cites=5785409592848039295&as_sdt=2005&sciodt=0,5&hl=en",299,2019-09-07 23:54:23,,,,,,,,,35,3.18,7,5,11
627,ag,6,"DJ McFarlane, RJ George, EG Barrett-Lennard, ...",Salinity in dryland agricultural systems: challenges and opportunities,2016,… in Dryland Agriculture,Springer,https://link.springer.com/chapter/10.1007/978-3-319-47928-6_19,"https://scholar.google.com/scholar?cites=3725294401969922367&as_sdt=2005&sciodt=0,5&hl=en",299,2019-09-07 23:36:05,,,,,,,,,6,2,2,4,3
234,rest,46,"M Dazy, V Jung, JF Férard, JF Masfaraud",Ecological recovery of vegetation on a coke-factory soil: role of plant antioxidant enzymes and possible implications in site restoration,2008,Chemosphere,Elsevier,https://www.sciencedirect.com/science/article/pii/S0045653508011806,"https://scholar.google.com/scholar?cites=17591721701162925254&as_sdt=2005&sciodt=0,5&hl=en",300,2019-09-07 23:54:23,,,,,,,,,46,4.18,12,4,11
411,ag,33,"RM Han, I Lefèvre, CJ Ruan, P Qin, S Lutts",NaCl differently interferes with Cd and Zn toxicities in the wetland halophyte species Kosteletzkya virginica (L.) Presl.,2012,Plant growth regulation,Springer,https://link.springer.com/article/10.1007/s10725-012-9697-z,"https://scholar.google.com/scholar?cites=5070814311231801763&as_sdt=2005&sciodt=0,5&hl=en",300,2019-09-07 23:36:05,,,,,,,,,33,4.71,7,5,7
220,ag,4,"X WANG, R WANG, X ZHOU, X XIANG, ...",Prospect about Remediation Potential of Halophytes Rhizospheric Microorganisms under Salinity Circumstance [J],2007,Chinese Journal of Soil …,en.cnki.com.cn,http://en.cnki.com.cn/Article_en/CJFDTotal-TRTB200705040.htm,"https://scholar.google.com/scholar?cites=10773259142919508245&as_sdt=2005&sciodt=0,5&hl=en",301,2019-09-07 23:36:05,,,,,,,,,4,0.33,1,5,12
354,rest,0,"LQZCS Xianwei, ZYZ Dongfeng",A Study on the Microbial Remediation to the Salinized Oil Contaminated Soil,2011,… Protection of Oil & Gas Fields,en.cnki.com.cn,http://en.cnki.com.cn/Article_en/CJFDTotal-YQTB201102004.htm,,301,2019-09-07 23:54:23,,,,,,,,,0,0,0,2,8
92,rest,1,A MASSAGE,Remediation of wetlands by Phragmites australis,2001,,researchgate.net,https://www.researchgate.net/profile/Fabrizio_Pietrini/publication/236027245_Remediation_of_wetlands_by_Phragmites_australis/links/00b49515daccae7691000000.pdf,"https://scholar.google.com/scholar?cites=7354106282643526074&as_sdt=2005&sciodt=0,5&hl=en",302,2019-09-07 23:54:23,PDF,,,,,,,,1,0.06,1,1,18
463,ag,14,"B Huchzermeyer, T Flowers","Putting halophytes to work–genetics, biochemistry and physiology",2013,Functional Plant Biology,CSIRO,https://www.publish.csiro.au/fp/Fulltext/fpv40n9_fo,"https://scholar.google.com/scholar?cites=9597505596817993371&as_sdt=2005&sciodt=0,5&hl=en",302,2019-09-07 23:36:05,,,,,,,,,14,2.33,7,2,6
412,ag,4,RC Hendricks,"Alternate-Fueled Flight: Halophytes, Algae, Bio-, and Synthetic Fuels",2012,,ntrs.nasa.gov,https://ntrs.nasa.gov/search.jsp?R=20120014219,"https://scholar.google.com/scholar?cites=6077700177227788038&as_sdt=2005&sciodt=0,5&hl=en",303,2019-09-07 23:36:05,,,,,,,,,4,0.57,4,1,7
672,rest,0,SM Call,"Plant Community and Nutrient Development within Four Estuary Restoration Sites in Kitsap County, Washington",2017,,cedar.wwu.edu,http://cedar.wwu.edu/cgi/viewcontent.cgi?article=1621&context=wwuet,,303,2019-09-07 23:54:23,PDF,,,,,,,,0,0,0,1,2
296,ag,4,JIA Jin,Research Progress on Gene Cloning Related to Salt-resistant in Halophytes [J],2009,Journal of Anhui Agricultural Sciences,en.cnki.com.cn,http://en.cnki.com.cn/Article_en/CJFDTotal-AHNY200922023.htm,"https://scholar.google.com/scholar?cites=9163234438975910750&as_sdt=2005&sciodt=0,5&hl=en",304,2019-09-07 23:36:05,,,,,,,,,4,0.4,4,1,10
604,rest,0,F Khorsandi,Haloculture: strategy for sustainable utilization of saline land and water resources,2016,Iranian Journal of Earth Sciences,researchgate.net,https://www.researchgate.net/profile/Farhad_Khorsandi/project/Haloculture/attachment/591c33f31042bfac891565a3/AS:494966137987072@1495020531017/download/Haloculture-+Strategy+for+Sustainable+Utilization+of+Saline+Land+and+Water+Resources+-+2016+-+IJES.pdf?context=ProjectUpdatesLog,,304,2019-09-07 23:54:23,PDF,,,,,,,,0,0,0,1,3
