,Field,Cites,Authors,Title,Year,Source,Publisher,ArticleURL,CitesURL,GSRank,QueryDate,Type,DOI,ISSN,CitationURL,Volume,Issue,StartPage,EndPage,ECC,CitesPerYear,CitesPerAuthor,AuthorCount,Age
522,ag,10,"M Öztürk, V Altay, S Gucel, A Guvensen",Halophytes in the East Mediterranean–their medicinal and other economical values,2014,Sabkha ecosystems,Springer,https://link.springer.com/chapter/10.1007/978-94-007-7411-7_18,"https://scholar.google.com/scholar?cites=1199437467170039519&as_sdt=2005&sciodt=0,5&hl=en",204,2019-09-07 23:36:05,,,,,,,,,10,2,3,4,5
368,ag,216,"S Shabala, A Mackay",Ion transport in halophytes,2011,Advances in botanical research,Elsevier,https://www.sciencedirect.com/science/article/pii/B9780123876928000059,"https://scholar.google.com/scholar?cites=15982743725520074714&as_sdt=2005&sciodt=0,5&hl=en",205,2019-09-07 23:36:05,,,,,,,,,216,27,108,2,8
786,rest,0,"FS Liliana, M del Fresno Carolina, W Cynthia",HALOPHYTES ENERGY FEEDSTOCKS: POSSIBILITIES FOR ARGENTINA,,researchgate.net,,https://www.researchgate.net/profile/Silvia_Falasca2/publication/288259617_Halophytes_energy_feedstocks_Possibilities_for_Argentina/links/57d0cc8808ae0c0081deb067/Halophytes-energy-feedstocks-Possibilities-for-Argentina.pdf,,205,2019-09-07 23:54:23,PDF,,,,,,,,0,0,0,3,
498,rest,0,"SL Falasca, CM del Fresno…",HALOPHYTES ENERGY FEEDSTOCKS: POSSIBILITIES FOR ARGENTINA,2014,International Journal of …,search.proquest.com,http://search.proquest.com/openview/4ca19ee76b10a7c2e3cb4b3cfd74206c/1?pq-origsite=gscholar&cbl=2034867,,206,2019-09-07 23:54:23,,,,,,,,,0,0,0,3,5
523,ag,6,"MA Khan, B Böer, M Öztürk, TZ Al Abdessalaam, ...",Sabkha ecosystems: volume IV: cash crop halophyte and biodiversity conservation,2014,,Springer,https://link.springer.com/content/pdf/10.1007/978-94-007-7411-7.pdf,"https://scholar.google.com/scholar?cites=9590860138896738878&as_sdt=2005&sciodt=0,5&hl=en",206,2019-09-07 23:36:05,BOOK,,,,,,,,6,1.2,1,5,5
66,rest,2,VP Singh,The new perspective in the halophyte,1998,Perspectives in Environment,books.google.com,https://books.google.com/books?hl=en&lr=&id=WAhg3NIYTJEC&oi=fnd&pg=PA189&dq=halophyte+restoration+remediation&ots=mv7omyZL2j&sig=hKgA3O61YOOjZjKicIdkxKzSYxo,"https://scholar.google.com/scholar?cites=4793122314171776943&as_sdt=2005&sciodt=0,5&hl=en",207,2019-09-07 23:54:23,,,,,,,,,2,0.1,2,1,21
568,ag,36,"J Wang, B Li, Y Meng, X Ma, Y Lai, ...",Transcriptomic profiling of the salt-stress response in the halophyte Halogeton glomeratus,2015,BMC …,bmcgenomics.biomedcentral.com,https://bmcgenomics.biomedcentral.com/articles/10.1186/s12864-015-1373-z,"https://scholar.google.com/scholar?cites=12514718677127862172&as_sdt=2005&sciodt=0,5&hl=en",207,2019-09-07 23:36:05,HTML,,,,,,,,36,9,6,6,4
15,ag,208,ND Vietmeyer,Lesser-known plants of potential use in agriculture and forestry,1986,Science,science.sciencemag.org,https://science.sciencemag.org/content/232/4756/1379.short,"https://scholar.google.com/scholar?cites=5189846523818669795&as_sdt=2005&sciodt=0,5&hl=en",208,2019-09-07 23:36:05,,,,,,,,,208,6.3,208,1,33
499,rest,18,"B Deák, O Valkó, B Tóthmérész…","Alkali marshes of Central-Europe: Ecology, management and nature conservation",2014,… and restoration …,hungary.pure.elsevier.com,https://hungary.pure.elsevier.com/en/publications/alkali-marshes-of-central-europe-ecology-management-and-nature-co,"https://scholar.google.com/scholar?cites=18160357413788708228&as_sdt=2005&sciodt=0,5&hl=en",208,2019-09-07 23:54:23,,,,,,,,,18,3.6,5,4,5
326,ag,5,R Martinez Garcia,Physiological studies of the halophyte Salicornia bigelovii: A potential food and biofuel crop for integrated aquaculture-agriculture systems,2010,,repository.arizona.edu,https://repository.arizona.edu/handle/10150/193968,"https://scholar.google.com/scholar?cites=15182738408637526189&as_sdt=2005&sciodt=0,5&hl=en",209,2019-09-07 23:36:05,,,,,,,,,5,0.56,5,1,9
596,rest,0,S GHULAM RASOOL,SALT RESISTANCE OF HALOPEPLIS PERFOLIATA: A COASTAL SALT MARSH STEM SUCCULENT HALOPHYTE,2016,,UNIVERSITY OF KARACHI …,,,209,2019-09-07 23:54:23,CITATION,,,,,,,,0,0,0,1,3
293,ag,27,"S Kachout, AB Mansoura, K Jaffel, ...",THE EFFECT OF SALINITY ON THE GROWTH OF THE HALOPHYTE ATRIPLEX HORTENSIS(CHENOPODIACEAE),2009,Applied Ecology and …,researchgate.net,https://www.researchgate.net/profile/Salma_Sai_Kachout2/publication/242757888_The_effect_of_salinity_on_the_growth_of_the_halophyte_Atriplex_Hortensis_Chenopodiaceae/links/00b7d534bf07494409000000.pdf,"https://scholar.google.com/scholar?cites=16027233685960817879&as_sdt=2005&sciodt=0,5&hl=en",210,2019-09-07 23:36:05,PDF,,,,,,,,27,2.7,7,4,10
749,rest,1,"H Shao, L Chu, H Lu, W Qi, X Chen…",Towards sustainable agriculture for the salt‐affected soil,2019,Land Degradation & …,Wiley Online Library,https://onlinelibrary.wiley.com/doi/abs/10.1002/ldr.3218,"https://scholar.google.com/scholar?cites=7107901513506116415&as_sdt=2005&sciodt=0,5&hl=en",210,2019-09-07 23:54:23,,,,,,,,,1,1,0,6,1
294,ag,39,"EP Glenn, C Mckeon, V Gerhart, PL Nagler, ...",Deficit irrigation of a landscape halophyte for reuse of saline waste water in a desert city,2009,Landscape and Urban …,Elsevier,https://www.sciencedirect.com/science/article/pii/S0169204608001643,"https://scholar.google.com/scholar?cites=11644464988759953734&as_sdt=2005&sciodt=0,5&hl=en",211,2019-09-07 23:36:05,,,,,,,,,39,3.9,8,5,10
384,rest,5,"HB Zhang, HJ Meng, XD Liu, WJ Zhao, XP Wang","Vegetation characteristics and ecological restoration technology of typical degradation wetlands in the middle of heihe river basin, zhangye city of gansu province",2012,Wetland Science,en.cnki.com.cn,http://en.cnki.com.cn/Article_en/CJFDTotal-KXSD201202013.htm,"https://scholar.google.com/scholar?cites=15568846337802157169&as_sdt=2005&sciodt=0,5&hl=en",211,2019-09-07 23:54:23,,,,,,,,,5,0.71,1,5,7
680,ag,335,IA Ungar,Seed germination and seed-bank ecology in halophytes,2017,Seed development and germination,taylorfrancis.com,https://www.taylorfrancis.com/books/e/9780203740071/chapters/10.1201/9780203740071-23,"https://scholar.google.com/scholar?cites=14020482318084481890&as_sdt=2005&sciodt=0,5&hl=en",212,2019-09-07 23:36:05,,,,,,,,,335,167.5,335,1,2
750,rest,0,"MV Faustino, MAF Faustino, DCGA Pinto","Halophytic Grasses, a New Source of Nutraceuticals? A Review on Their Secondary Metabolites and Biological Activities",2019,International journal of …,mdpi.com,https://www.mdpi.com/1422-0067/20/5/1067,,212,2019-09-07 23:54:23,,,,,,,,,0,0,0,3,1
164,ag,36,"X Liu, Y Yang, W Li, C Li, D Duan, ...",Interactive effects of sodium chloride and nitrogen on growth and ion accumulation of a halophyte,2005,Communications in soil …,Taylor & Francis,https://www.tandfonline.com/doi/abs/10.1081/LCSS-200028936,"https://scholar.google.com/scholar?cites=6119471931502341102&as_sdt=2005&sciodt=0,5&hl=en",213,2019-09-07 23:36:05,,,,,,,,,36,2.57,6,6,14
347,rest,2,L Zhang,A biological approach to salinized soil amelioration in arid Northwest China–Saline water irrigated trees and shrubs on saline sodic soil,2011,"Department of Water Resources Engineering, Lund …",tvrl.lth.se,https://www.tvrl.lth.se/fileadmin/tvrl/files/lb_day/165-182_Festskr.pdf,"https://scholar.google.com/scholar?cites=18199112594264838886&as_sdt=2005&sciodt=0,5&hl=en",213,2019-09-07 23:54:23,PDF,,,,,,,,2,0.25,2,1,8
258,ag,495,"J Rozema, T Flowers",Crops for a salinized world,2008,Science,science.sciencemag.org,https://science.sciencemag.org/content/322/5907/1478.short,"https://scholar.google.com/scholar?cites=818193430755412721&as_sdt=2005&sciodt=0,5&hl=en",214,2019-09-07 23:36:05,,,,,,,,,495,45,248,2,11
751,rest,0,"NAK Sima, A Ebadi, N Reiahisamani…","Bio-based remediation of petroleum-contaminated saline soils: Challenges, the current state-of-the-art and future prospects",2019,Journal of Environmental …,Elsevier,https://www.sciencedirect.com/science/article/pii/S0301479719311946,,214,2019-09-07 23:54:23,,,,,,,,,0,0,0,4,1
430,rest,98,"O Shelef, A Gross, S Rachmilevitch",Role of plants in a constructed wetland: current and new perspectives,2013,Water,mdpi.com,https://www.mdpi.com/2073-4441/5/2/405,"https://scholar.google.com/scholar?cites=15359304057587843470&as_sdt=2005&sciodt=0,5&hl=en",215,2019-09-07 23:54:23,,,,,,,,,98,16.33,33,3,6
457,ag,30,"HL Wang, CY Tian, L Jiang, L Wang",Remediation of heavy metals contaminated saline soils: a halophyte choice?,2013,,ACS Publications,https://pubs.acs.org/doi/full/10.1021/es405052j,"https://scholar.google.com/scholar?cites=10705065840483523796&as_sdt=2005&sciodt=0,5&hl=en",215,2019-09-07 23:36:05,,,,,,,,,30,5,8,4,6
369,ag,110,"Y Ventura, WA Wuddineh, M Myrzabayeva, ...",Effect of seawater concentration on the productivity and nutritional value of annual Salicornia and perennial Sarcocornia halophytes as leafy vegetable crops,2011,Scientia …,Elsevier,https://www.sciencedirect.com/science/article/pii/S0304423811000537,"https://scholar.google.com/scholar?cites=17017234431417319608&as_sdt=2005&sciodt=0,5&hl=en",216,2019-09-07 23:36:05,,,,,,,,,110,13.75,28,4,8
597,rest,4,"SR Gupta, JC Dagar",Agroforestry for ecological restoration of salt-affected lands,2016,Innovative Saline Agriculture,Springer,https://link.springer.com/chapter/10.1007/978-81-322-2770-0_8,"https://scholar.google.com/scholar?cites=3326627227754063583&as_sdt=2005&sciodt=0,5&hl=en",216,2019-09-07 23:54:23,,,,,,,,,4,1.33,2,2,3
259,ag,4,"A Belligno, V Sardo",Studies on halophytes and salinity problems in Mediterranean agriculture,2008,… and Halophytes: Restoration and Utilisation,Springer,https://link.springer.com/chapter/10.1007/978-1-4020-6720-4_4,"https://scholar.google.com/scholar?cites=9776200357922579267&as_sdt=2005&sciodt=0,5&hl=en",217,2019-09-07 23:36:05,,,,,,,,,4,0.36,2,2,11
385,rest,0,"OM İBRAHİM, MM TAWFIK…",Tuzdan Etkilenmiş Toprakların Kochia indica İle Biyolojik Islahı,2012,Selçuk Tarım Bilimleri …,stgbd.selcuk.edu.tr,http://stgbd.selcuk.edu.tr/stgbd/article/view/255,,217,2019-09-07 23:54:23,,,,,,,,,0,0,0,3,7
80,ag,6,"H Xuguang, Z Kefu",STUDIES OF MECHANISM OF SALT INJURIES IN NONHALOPHYTE COTTON AND HALOPHYTE SALTBUSH,1999,JOURNAL OF SHANDONG UNIVERSITY …,en.cnki.com.cn,http://en.cnki.com.cn/Article_en/CJFDTotal-SDDX902.020.htm,"https://scholar.google.com/scholar?cites=18123735368196669101&as_sdt=2005&sciodt=0,5&hl=en",218,2019-09-07 23:36:05,,,,,,,,,6,0.3,3,2,20
304,rest,0,A Varennes,Use of hydrophilic polymers from disposable diapers to restore metal contaminated soils,2010,RAMIRAN International Conference (14 th): Treatment …,repository.utl.pt,http://www.repository.utl.pt/handle/10400.5/2637,,218,2019-09-07 23:54:23,,,,,,,,,0,0,0,1,9
87,ag,23,"S Cherian, MP Reddy","Salt tolerance in the Halophyte Suaeda nudiflora moq: effect of NaCl on growth, ion accumulation and oxidative enzymes",2000,Indian Journal of Plant Physiology,samviti.com,https://www.samviti.com/img/1341/society/publication/ijpp-5-1-006.pdf,"https://scholar.google.com/scholar?cites=14707722828776723471&as_sdt=2005&sciodt=0,5&hl=en",219,2019-09-07 23:36:05,PDF,,,,,,,,23,1.21,12,2,19
752,rest,0,"P Maleki, S Saadat, HA Bahrami, H Rezaei…",Accumulation of Ions in Shoot and Seed of Quinoa (Chenopodium ‎quinoa Willd.) Under Salinity Stress,2019,… in soil science and …,Taylor & Francis,https://www.tandfonline.com/doi/abs/10.1080/00103624.2019.1589486,,219,2019-09-07 23:54:23,,,,,,,,,0,0,0,5,1
194,ag,64,SMS Al-Garni,Increasing NaCl-salt tolerance of a halophytic plant Phragmites australis by mycorrhizal symbiosis.,2006,American-Eurasian Journal of Agricultural and …,cabdirect.org,https://www.cabdirect.org/cabdirect/abstract/20073256420,"https://scholar.google.com/scholar?cites=6493894629074409977&as_sdt=2005&sciodt=0,5&hl=en",220,2019-09-07 23:36:05,,,,,,,,,64,4.92,64,1,13
706,rest,0,"S Ganesan, RK Chellappan","Morphological, biochemical and antioxidant enzyme adaptation of Suaeda maritima growing in textile dye effluent irrigated soil",2018,Indian journal of plant physiology,Springer,https://link.springer.com/article/10.1007/s40502-017-0317-9,,220,2019-09-07 23:54:23,,,,,,,,,0,0,0,2,1
620,ag,7,"S Karakas, MA Cullu, C Kaya, M Dikilitas",Halophytic companion plants improve growth and physiological parameters of tomato plants grown under salinity,2016,Pak. J. Bot,researchgate.net,https://www.researchgate.net/profile/Cengiz_Kaya3/publication/299364896_Halophytic_companion_plants_improve_growth_and_physiological_parameters_of_tomato_plants_grown_under_salinity/links/571f57f908aefa64889a7187/Halophytic-companion-plants-improve-growth-and-physiological-parameters-of-tomato-plants-grown-under-salinity.pdf,"https://scholar.google.com/scholar?cites=12587139860769305164&as_sdt=2005&sciodt=0,5&hl=en",221,2019-09-07 23:36:05,PDF,,,,,,,,7,2.33,2,4,3
662,rest,0,"K ROY, S IWATA, Y KATO",The Effects of Land Restoration on Soil Fertility in Tsunami-inundated Farmlands of Miyagi Prefecture in Japan,2017,International Journal of …,researchgate.net,https://www.researchgate.net/profile/Kingshuk_Roy/publication/322929960_The_Effects_of_Land_Restoration_on_Soil_Fertility_in_Tsunami-inundated_Farmlands_of_Miyagi_Prefecture_in_Japan/links/5a7901f8a6fdcc4ffe90bd17/The-Effects-of-Land-Restoration-on-Soil-Fertility-in-Tsunami-inundated-Farmlands-of-Miyagi-Prefecture-in-Japan.pdf,,221,2019-09-07 23:54:23,PDF,,,,,,,,0,0,0,3,2
348,rest,1,"ME Lucero, JR Barrow…",Examining Endophyte Interactions within Fourwing Saltbush (Atriplex canescens),2011,Natural Resources …,digitalcommons.usu.edu,https://digitalcommons.usu.edu/nrei/vol16/iss1/21/,"https://scholar.google.com/scholar?cites=17621280051864306170&as_sdt=2005&sciodt=0,5&hl=en",222,2019-09-07 23:54:23,,,,,,,,,1,0.13,0,3,8
681,ag,10,"F Al Marzooqi, LF Yousef",Biological response of a sandy soil treated with biochar derived from a halophyte (Salicornia bigelovii),2017,Applied soil ecology,Elsevier,https://www.sciencedirect.com/science/article/pii/S0929139316304474,"https://scholar.google.com/scholar?cites=5131717160574794560&as_sdt=2005&sciodt=0,5&hl=en",222,2019-09-07 23:36:05,,,,,,,,,10,5,5,2,2
165,ag,6,V Sardo,Halophytes and salt-tolerant glycophytes a potential resource,2005,The use of non-conventional water resources. Bari …,ressources.ciheam.org,http://ressources.ciheam.org/om/pdf/a66/00800301.pdf,"https://scholar.google.com/scholar?cites=3684872570303297782&as_sdt=2005&sciodt=0,5&hl=en",223,2019-09-07 23:36:05,PDF,,,,,,,,6,0.43,6,1,14
753,rest,0,"K Isobe, E Nakajima, N Morita, S Kawakura…",Effects of NaCl on Growth and Cesium Absorption in Quinoa (Chenopodium quinoa Willd.),2019,"Water, Air, & Soil …",Springer,https://link.springer.com/article/10.1007/s11270-019-4120-2,,223,2019-09-07 23:54:23,HTML,,,,,,,,0,0,0,5,1
175,rest,8,"TA Aschenbach, K Kindscher","Plant species on salt-affected soil at Cheyenne Bottoms, Kansas",2006,Transactions of the Kansas Academy of …,BioOne,https://bioone.org/journals/Transactions-of-the-Kansas-Academy-of-Science/volume-109/issue-3/0022-8443(2006)109[207:PSOSSA]2.0.CO;2/Plant-species-on-salt-affected-soil-at-Cheyenne-Bottoms-Kansas/10.1660/0022-8443(2006)109[207:PSOSSA]2.0.CO;2.short,"https://scholar.google.com/scholar?cites=9817414529415792518&as_sdt=2005&sciodt=0,5&hl=en",224,2019-09-07 23:54:23,,,,,,,,,8,0.62,4,2,13
621,ag,8,"N Akinshina, A Azizov, T Karasyova, E Klose",On the issue of halophytes as energy plants in saline environment,2016,Biomass and Bioenergy,Elsevier,https://www.sciencedirect.com/science/article/pii/S096195341630188X,"https://scholar.google.com/scholar?cites=15279492100269768161&as_sdt=2005&sciodt=0,5&hl=en",224,2019-09-07 23:36:05,,,,,,,,,8,2.67,2,4,3
327,ag,5,"XQ Mo, HY Li",Application of wild halophytes in Tianjin coastal wetland,2010,Urban Environment & Urban Ecology,en.cnki.com.cn,http://en.cnki.com.cn/Article_en/CJFDTotal-CHCS201002005.htm,"https://scholar.google.com/scholar?cites=8310976902471577567&as_sdt=2005&sciodt=0,5&hl=en",225,2019-09-07 23:36:05,,,,,,,,,5,0.56,3,2,9
431,rest,10,"J Paz-Ferreiro, H Lu, S Fu, A Méndez…",Use of phytoremediation and biochar to remediate heavy metal polluted soils: a review.,2013,Solid Earth …,researchgate.net,https://www.researchgate.net/profile/Ana_Mendez7/publication/260957443_Use_of_phytoremediation_and_biochar_to_remediate_heavy_metal_polluted_soils_A_review/links/571fcd8f08aeaced788aca8f.pdf,"https://scholar.google.com/scholar?cites=11046158526330472534&as_sdt=2005&sciodt=0,5&hl=en",225,2019-09-07 23:54:23,PDF,,,,,,,,10,1.67,2,5,6
405,ag,8,"VS Rathore, JP Singh, MM Roy","Haloxylon stocksii (Boiss.) Benth. et Hook. f., a promising halophyte: distribution, cultivation and utilization",2012,Genetic resources and crop evolution,Springer,https://link.springer.com/article/10.1007/s10722-012-9843-5,"https://scholar.google.com/scholar?cites=9228535412482300777&as_sdt=2005&sciodt=0,5&hl=en",226,2019-09-07 23:36:05,,,,,,,,,8,1.14,3,3,7
500,rest,23,"S Arora, MJ Vanza, R Mehta, C Bhuva, PN Patel",Halophilic microbes for bio-remediation of salt affected soils,2014,,krishi.icar.gov.in,http://krishi.icar.gov.in/jspui/handle/123456789/7268,"https://scholar.google.com/scholar?cites=274904691868684665&as_sdt=2005&sciodt=0,5&hl=en",226,2019-09-07 23:54:23,,,,,,,,,23,4.6,5,5,5
569,ag,8,"S Gairola, A Bhatt, A El-Keblawy",A perspective on potential use of halophytes for reclamation of salt-affected lands,2015,Wulfenia,researchgate.net,https://www.researchgate.net/profile/Arvind_Singh56/post/Is_there_any_work_related_to_saline_land_and_measures_to_overcome_from_this_problem/attachment/59d64acb79197b80779a5052/AS:477141558140937@1490770820246/download/Gairola+et+al+2015.pdf,"https://scholar.google.com/scholar?cites=8932416698577972111&as_sdt=2005&sciodt=0,5&hl=en",227,2019-09-07 23:36:05,PDF,,,,,,,,8,2,3,3,4
663,rest,47,"S Wu, H He, X Inthapanya, C Yang, L Lu…",Role of biochar on composting of organic wastes and remediation of contaminated soils—a review,2017,… Science and Pollution …,Springer,https://link.springer.com/article/10.1007/s11356-017-9168-1,"https://scholar.google.com/scholar?cites=14138270044909738679&as_sdt=2005&sciodt=0,5&hl=en",227,2019-09-07 23:54:23,,,,,,,,,47,23.5,8,6,2
501,rest,0,FF Congressi,Proceedings of 4th International Symposium on Sediment Management,2014,,researchgate.net,https://www.researchgate.net/profile/Emanuele_Ponis/publication/266209780_PHYTOREMEDIATION_TECHNIQUES_APPLIED_ON_VENICE_LAGOON%27S_SEDIMENTS_PRELIMINARY_RESULTS_OF_A_MESOCOSM_AND_FIELD_STUDY/links/583bf5e108ae3d9172423749/PHYTOREMEDIATION-TECHNIQUES-APPLIED-ON-VENICE-LAGOONS-SEDIMENTS-PRELIMINARY-RESULTS-OF-A-MESOCOSM-AND-FIELD-STUDY.pdf,,228,2019-09-07 23:54:23,PDF,,,,,,,,0,0,0,1,5
622,ag,12,"S Devi, AS Nandwal, R Angrish, SS Arya, ...",Phytoremediation potential of some halophytic species for soil salinity,2016,International journal …,Taylor & Francis,https://www.tandfonline.com/doi/abs/10.1080/15226514.2015.1131229,"https://scholar.google.com/scholar?cites=10974232784164492538&as_sdt=2005&sciodt=0,5&hl=en",228,2019-09-07 23:36:05,,,,,,,,,12,4,2,5,3
102,rest,803,"C D'antonio, LA Meyerson",Exotic plant species as problems and solutions in ecological restoration: a synthesis,2002,Restoration Ecology,Wiley Online Library,https://onlinelibrary.wiley.com/doi/abs/10.1046/j.1526-100X.2002.01051.x,"https://scholar.google.com/scholar?cites=12675180727582791189&as_sdt=2005&sciodt=0,5&hl=en",229,2019-09-07 23:54:23,,,,,,,,,803,47.24,402,2,17
328,ag,43,"M Kafi, H Asadi, A Ganjeali",Possible utilization of high-salinity waters and application of low amounts of water for production of the halophyte Kochia scoparia as alternative fodder in saline …,2010,Agricultural Water Management,Elsevier,https://www.sciencedirect.com/science/article/pii/S0378377409002522,"https://scholar.google.com/scholar?cites=8101775580605735166&as_sdt=2005&sciodt=0,5&hl=en",229,2019-09-07 23:36:05,,,,,,,,,43,4.78,14,3,9
149,ag,36,H Akhani,Halophytic vegetation of Iran: towards a syntaxonomical classification,2004,Annali di botanica,,,"https://scholar.google.com/scholar?cites=4927921384552268711&as_sdt=2005&sciodt=0,5&hl=en",230,2019-09-07 23:36:05,CITATION,,,,,,,,36,2.4,36,1,15
157,rest,7,"M Krishnapillai, RS Ranjan",Evaluating the phytoremediation potential of Atriplex patula on salt contaminated soil,2005,The Canadin Society Engineering …,csbe-scgab.ca,http://www.csbe-scgab.ca/docs/meetings/2005/05-052.pdf,"https://scholar.google.com/scholar?cites=9315281015456841801&as_sdt=2005&sciodt=0,5&hl=en",230,2019-09-07 23:54:23,PDF,,,,,,,,7,0.5,4,2,14
50,ag,40,"D Pasternak, A Nerd",Research and utilization of halophytes in Israel,1995,Halophytes and biosaline agriculture,books.google.com,https://books.google.com/books?hl=en&lr=&id=k_mW2p_KnaYC&oi=fnd&pg=PA325&dq=halophyte+agriculture&ots=q3GGd0A5Hh&sig=XtBktgS81Fdq8R6OPZYO6pD4cxo,"https://scholar.google.com/scholar?cites=10442748576616277654&as_sdt=2005&sciodt=0,5&hl=en",231,2019-09-07 23:36:05,,,,,,,,,40,1.67,20,2,24
787,rest,0,J GALLAGHER,"Improving Wetland Plants: A Good, Bad, or an “It Depends” Idea?",,NATIONAL WETLANDS NEWSLETTER,elr.info,https://elr.info/sites/default/files/gallagher.pdf,,231,2019-09-07 23:54:23,PDF,,,,,,,,0,0,0,1,
166,ag,297,"NB Amor, KB Hamed, A Debez, C Grignon, C Abdelly",Physiological and antioxidant responses of the perennial halophyte Crithmummaritimum to salinity,2005,Plant Science,Elsevier,https://www.sciencedirect.com/science/article/pii/S0168945204004741,"https://scholar.google.com/scholar?cites=16179208628896086249&as_sdt=2005&sciodt=0,5&hl=en",232,2019-09-07 23:36:05,,,,,,,,,297,21.21,59,5,14
386,rest,22,"MV RamanaRao, D Weindorf, G Breitenbeck…",Differential Expression of the Transcripts of Spartina alterniflora Loisel (Smooth Cordgrass) Induced in Response to Petroleum Hydrocarbon,2012,Molecular …,Springer,https://link.springer.com/article/10.1007/s12033-011-9436-0,"https://scholar.google.com/scholar?cites=16220281754023526558&as_sdt=2005&sciodt=0,5&hl=en",232,2019-09-07 23:54:23,,,,,,,,,22,3.14,6,4,7
458,ag,8,"W Al-Yamani, S Kennedy, S Sgouridis, ...","A Land Suitability Study for the Sustainable Cultivation of the Halophyte Salicornia bigelovii: The Case of Abu Dhabi, UAE",2013,Arid land research and …,Taylor & Francis,https://www.tandfonline.com/doi/abs/10.1080/15324982.2013.771230,"https://scholar.google.com/scholar?cites=13753793123003368052&as_sdt=2005&sciodt=0,5&hl=en",233,2019-09-07 23:36:05,,,,,,,,,8,1.33,2,4,6
664,rest,4,"TJ Purakayastha, A Mandal, S Kumari",Phytoremediation of metal-and salt-affected soils,2017,… of Salt Affected Soils: An Indian …,Springer,https://link.springer.com/chapter/10.1007/978-3-319-48257-6_11,"https://scholar.google.com/scholar?cites=16370193252006157555&as_sdt=2005&sciodt=0,5&hl=en",233,2019-09-07 23:54:23,,,,,,,,,4,2,1,3,2
121,rest,21,"Z Xuejie, F Shoujin, L Fazeng",Development and Utilization of Suaede salsa in China [J],2003,Chinese Wild Plant Resources,en.cnki.com.cn,http://en.cnki.com.cn/Article_en/CJFDTotal-ZYSZ200302000.htm,"https://scholar.google.com/scholar?cites=3285252294109615305&as_sdt=2005&sciodt=0,5&hl=en",234,2019-09-07 23:54:23,,,,,,,,,21,1.31,7,3,16
682,ag,25,"S Qin, WW Feng, TT Wang, P Ding, K Xing, JH Jiang",Plant growth-promoting effect and genomic analysis of the beneficial endophyte Streptomyces sp. KLBMP 5084 isolated from halophyte Limonium sinense,2017,Plant and soil,Springer,https://link.springer.com/article/10.1007/s11104-017-3192-2,"https://scholar.google.com/scholar?cites=18159287491730732074&as_sdt=2005&sciodt=0,5&hl=en",234,2019-09-07 23:36:05,,,,,,,,,25,12.5,4,6,2
141,rest,6,"Y HE, J XU, Z LI",Rhizosphere Stress Effect and Rhizoid-remediation of Organic Pollutants in Soil [J],2004,Chinese Journal of Soil Science,en.cnki.com.cn,http://en.cnki.com.cn/Article_en/CJFDTotal-TRTB200405031.htm,"https://scholar.google.com/scholar?cites=6579942218791713862&as_sdt=2005&sciodt=0,5&hl=en",235,2019-09-07 23:54:23,,,,,,,,,6,0.4,2,3,15
216,ag,113,"I Slama, T Ghnaya, D Messedi, K Hessini, ...",Effect of sodium chloride on the response of the halophyte species Sesuvium portulacastrum grown in mannitol-induced water stress,2007,Journal of Plant …,Springer,https://link.springer.com/article/10.1007/s10265-006-0056-x,"https://scholar.google.com/scholar?cites=1909898062575287626&as_sdt=2005&sciodt=0,5&hl=en",235,2019-09-07 23:36:05,,,,,,,,,113,9.42,23,5,12
28,ag,34,RJ George,Estimating and modifying the effects of agricultural development on the groundwater balance of large wheatbelt catchments,1992,Applied Hydrogeology,Springer,https://link.springer.com/article/10.1007/s100400050026,"https://scholar.google.com/scholar?cites=7680994626184089444&as_sdt=2005&sciodt=0,5&hl=en",236,2019-09-07 23:36:05,,,,,,,,,34,1.26,34,1,27
387,rest,0,"NT Saxena, AE Thomas, S Johnson, JP Venners…",Green Planet Architecture-A Methodology for Self-Sustainable Distributed Renewable Energy Ecosystems,2012,,ntrs.nasa.gov,https://ntrs.nasa.gov/search.jsp?R=20120003419,,236,2019-09-07 23:54:23,,,,,,,,,0,0,0,5,7
67,ag,5,XWZZJ Huixian,Study on Root Anatomic Structure of Some Halophytes [J],1998,JOURNAL OF GANSU AGRICULTURAL …,en.cnki.com.cn,http://en.cnki.com.cn/Article_en/CJFDTotal-GSND801.020.htm,"https://scholar.google.com/scholar?cites=14452364904420258638&as_sdt=2005&sciodt=0,5&hl=en",237,2019-09-07 23:36:05,,,,,,,,,5,0.24,5,1,21
349,rest,1,"B Chen, H Xu, Z Zhang",Laboratory experiments of cyclic electro-osmosis method on saline soil remediation,2011,2011 International Conference on …,ieeexplore.ieee.org,https://ieeexplore.ieee.org/abstract/document/5775968/,"https://scholar.google.com/scholar?cites=11725887380148094272&as_sdt=2005&sciodt=0,5&hl=en",237,2019-09-07 23:54:23,,,,,,,,,1,0.13,0,3,8
